{
  "$schema": "https://json-schema.org/draft/2020-12/schema",
  "$id": "https://putnamworkbook.local/schema/library-catalog.schema.json",
  "title": "Offline mathematics library catalog",
  "type": "object",
  "additionalProperties": false,
  "required": ["schemaVersion", "contentSchemaVersion", "collections", "topics"],
  "properties": {
    "schemaVersion": { "const": 1 },
    "contentSchemaVersion": { "const": 3 },
    "collections": { "type": "array", "items": { "$ref": "#/$defs/collection" } },
    "topics": { "type": "array", "minItems": 1, "items": { "$ref": "#/$defs/topic" } }
  },
  "$defs": {
    "id": { "type": "string", "pattern": "^[A-Za-z0-9._-]+$" },
    "positiveOrder": { "type": "integer", "minimum": 1 },
    "set": {
      "type": "object",
      "additionalProperties": false,
      "required": ["id", "title", "displayOrder"],
      "properties": {
        "id": { "$ref": "#/$defs/id" },
        "title": { "type": "string", "minLength": 1 },
        "displayOrder": { "$ref": "#/$defs/positiveOrder" },
        "metadata": {
          "type": "object",
          "additionalProperties": false,
          "properties": {
            "competitionYear": { "type": "integer", "minimum": 1 },
            "administrationYear": { "type": "integer", "minimum": 1 }
          }
        }
      }
    },
    "collection": {
      "type": "object",
      "additionalProperties": false,
      "required": ["id", "title", "kind", "displayOrder", "sets"],
      "properties": {
        "id": { "$ref": "#/$defs/id" },
        "title": { "type": "string", "minLength": 1 },
        "kind": { "type": "string", "minLength": 1 },
        "displayOrder": { "$ref": "#/$defs/positiveOrder" },
        "sets": { "type": "array", "items": { "$ref": "#/$defs/set" } }
      }
    },
    "topic": {
      "type": "object",
      "additionalProperties": false,
      "required": ["id", "label", "displayOrder"],
      "properties": {
        "id": { "$ref": "#/$defs/id" },
        "label": { "type": "string", "minLength": 1 },
        "displayOrder": { "$ref": "#/$defs/positiveOrder" }
      }
    }
  }
}
