{
  "schemaVersion": 1,
  "contentSchemaVersion": 3,
  "collections": [
    {
      "id": "putnam",
      "title": "William Lowell Putnam Mathematical Competition",
      "kind": "competition",
      "displayOrder": 1,
      "sets": [
        { "id": "2025", "title": "2025", "displayOrder": 1, "metadata": { "competitionYear": 2025 } },
        { "id": "2024", "title": "2024", "displayOrder": 2, "metadata": { "competitionYear": 2024 } },
        { "id": "2023", "title": "2023", "displayOrder": 3, "metadata": { "competitionYear": 2023 } },
        { "id": "2022", "title": "2022", "displayOrder": 4, "metadata": { "competitionYear": 2022 } },
        { "id": "2021", "title": "2021", "displayOrder": 5, "metadata": { "competitionYear": 2021 } },
        { "id": "2020", "title": "2020", "displayOrder": 6, "metadata": { "competitionYear": 2020, "administrationYear": 2021 } }
      ]
    }
  ],
  "topics": [
    { "id": "algebra", "label": "Algebra", "displayOrder": 1 },
    { "id": "analysis", "label": "Analysis", "displayOrder": 2 },
    { "id": "calculus", "label": "Calculus", "displayOrder": 3 },
    { "id": "combinatorics", "label": "Combinatorics", "displayOrder": 4 },
    { "id": "functional-equations", "label": "Functional Equations", "displayOrder": 5 },
    { "id": "geometry", "label": "Geometry", "displayOrder": 6 },
    { "id": "inequalities", "label": "Inequalities", "displayOrder": 7 },
    { "id": "integrals", "label": "Integrals", "displayOrder": 8 },
    { "id": "linear-algebra", "label": "Linear Algebra", "displayOrder": 9 },
    { "id": "number-theory", "label": "Number Theory", "displayOrder": 10 },
    { "id": "polynomials", "label": "Polynomials", "displayOrder": 11 },
    { "id": "probability", "label": "Probability", "displayOrder": 12 },
    { "id": "sequences-series", "label": "Sequences & Series", "displayOrder": 13 }
  ]
}
